Divs,Source,VAP,Lemma,VAP_values,ADV,Target,Target_lemma,Phrase Complete
L4_CH_01,nous,connaissons,connaître,7,NAN,que le Blanc n’ est pas le Noir,que le blanc n’ être pas le noir,"Car lorsque nous connaissons que le Blanc n’est pas le Noir, que faisons-nous autre chose qu’appercevoir que ces deux idées ne conviennent point ensemble ?"
L4_CH_01,nous,affirmons,affirmer,nan,NAN,qu’ il est fixe,qu’ il être fixe,"Ainsi, quand nous affirmons touchant l’Or, qu’il est fixe, la connaissance que nous avons de cette vérité se réduit uniquement à ceci, que la fixité ou la puissance de demeurer dans le Feu sans se consumer, est une idée qui se trouve toûjours jointe avec cette espèce particuliére de jaune, de pesanteur, de fusibilité, de malléabilité et de capacité d’être dissous dans l’Eau Regale, qui compose notre idée complexe que nous désignons par le mot Or."
L4_CH_01,je,trouve,trouver,5.85,cependant,que cette connaissance renferme une parfaite certitude,que ce connaissance renfermer un parfait certitude,"cependant je trouve après y avoir bien pensé, que cette connaissance renferme une parfaite certitude, et est en effet une véritable connaissance."
L4_CH_02,nous,trouverons,trouver,5.85,NAN,"que quelquefois l’ Esprit aperçoit la convenance ou la disconvenance de deux Idées , immédiatement par elles - mêmes , sans l’ intervention d’ aucun autre , ce qu’ on peut appeller une Connaissance intuitive .","que quelquefois l’ esprit apercevoir le convenance ou le disconvenance de deux idée , immédiatement par lui - même , sans l’ intervention d’ aucun autre , ce qu’ on pouvoir appeller un connaissance intuitif .","Car si nous réfléchissons sur notre manière de penser, nous trouverons que quelquefois l’Esprit aperçoit la convenance ou la disconvenance de deux Idées, immédiatement par elles-mêmes, sans l’intervention d’aucun autre, ce qu’on peut appeller une Connaissance intuitive."
L4_CH_02,je,crois,croire,5.03,pourtant,que dans ce cas -là nous avons un dégré d’ évidence qui nous éleve au dessus du doute,que dans ce cas -là nous avoir un dégré d’ évidence qui nous éleve au dessus de doute,"Pour moi, je crois pourtant que dans ce cas-là nous avons un dégré d’évidence qui nous éleve au dessus du doute."
L4_CH_02,nous,trouvons,trouver,5.85,certainement,que le Plaisir ou la Douleur vient en suite de l’ application de certains Objets sur nous,que le plaisir ou le douleur venir en suite de l’ application de certain objet sur nous,"je répons que comme nous trouvons certainement que le Plaisir ou la Douleur vient en suite de l’application de certains Objets sur nous, desquels Objets nous apercevons l’existence actuellement ou en songe, par le moyen de nos Sens, cette certitude est aussi grande que notre bonheur ou notre misére, deux choses au delà desquelles nous n’avons aucun intérêt par rapport à notre Connaissance ou à notre existence."
L4_CH_03,nous,concevons,concevoir,6,NAN,"que le Corps produit le Plaisir ou la Douleur , ou bien l’ idée d’ une Couleur ou d’ un Son","que le corps produire le plaisir ou le douleur , ou bien l’ idée d’ un couleur ou d’ un son","de sorte que lorsque nous concevons que le Corps produit le Plaisir ou la Douleur, ou bien l’idée d’une Couleur ou d’un Son, nous sommes obligez d’abandonner notre Raison, d’aller au delà de nos propres idées, et d’attribuer cette production au seul bon plaisir de notre Créateur."
L4_CH_03,je,connais,connaître,7,NAN,qu’ un Triangle a trois angles égaux à deux Droits,qu’ un triangle avoir trois angle égal à deux droit,"et l’idée qu’on désigne par le nom d’injustice étant l’invasion ou la violation d’un Droit, il est évident que ces idées étant ainsi déterminées, et ces noms leur étant attachez, je puis connaître aussi certainement que cette Proposition est véritable que je connais qu’un Triangle a trois angles égaux à deux Droits."
L4_CH_03,nous,trouverons,trouver,5.85,NAN,"que cette Ignorance nous cache dans une obscurité impénétrable presque tout le Monde intellectuel , qui certainement est et plus grand et plus beau que le Monde materiel","que ce ignorance nous cache dans un obscurité impénétrable presque tout le monde intellectuel , qui certainement être et plus grand et plus beau que le monde materiel","Que si nous ajoutons à cela la consideration de ce nombre infini d’Esprits qui peuvent exister et qui existent probablement, mais qui sont encore plus éloignés de notre Connaissance, puisqu’ils nous sont absolument inconnus et que nous ne saurions nous former aucune idée distincte de leurs différens ordres ou différentes Espèces, nous trouverons que cette Ignorance nous cache dans une obscurité impénétrable presque tout le Monde intellectuel, qui certainement est et plus grand et plus beau que le Monde materiel."
L4_CH_03,nous,trouvons,trouver,5.85,NAN,"que des Choses agissent régulièrement , aussi loin que s’ étendent nos Observations","que un chose agir régulièrement , aussi loin que s’ étendre notre observation","Lorsque nous trouvons que des Choses agissent régulièrement, aussi loin que s’étendent nos Observations, nous pouvons conclure qu’elles agissent en vertu d’une Loi qui leur est prescrite, mais qui pourtant nous est inconnue"
L4_CH_04,nous,trouverons,trouver,5.85,NAN,que toute cette connaissance roule uniquement sur nos propres idées,que tout ce connaissance roule uniquement sur notre propre idée,"Cependant à bien considérer la chose, nous trouverons que toute cette connaissance roule uniquement sur nos propres idées."
L4_CH_04,nous,trouverons,trouver,5.85,NAN,"que l’ idée de la figure , du mouvement et de la vie d’ un homme destitué de Raison , est aussi bien une Idée distincte , et constitué aussi bien une espèce de Choses distincte de l’ Homme et de la Bête , que l’ Idée de la figure d’ un Ane accompagnée de Raison serait différente de celle de l’ Homme ou de la Bête , et constituerait une Espèce d’ Animal qui tiendrait le milieu entre l’ Homme et la Bête , ou qui serait distinct de l’ un et de l’ autre","que l’ idée de le figure , de mouvement et de le vie d’ un homme destituer de raison , être aussi bien un idée distinct , et constituer aussi bien un espèce de chose distinct de l’ homme et de le bête , que l’ idée de le figure d’ un Ane accompagner de raison être différent de celui de l’ homme ou de le bête , et constituer un espèce d’ animal qui tenir le milieu entrer l’ homme et le bête , ou qui être distinct de l’ un et de l’ autre",", nous trouverons que l’idée de la figure, du mouvement et de la vie d’un homme destitué de Raison, est aussi bien une Idée distincte, et constitué aussi bien une espèce de Choses distincte de l’Homme et de la Bête, que l’Idée de la figure d’un Ane accompagnée de Raison serait différente de celle de l’Homme ou de la Bête, et constituerait une Espèce d’Animal qui tiendrait le milieu entre l’Homme et la Bête, ou qui serait distinct de l’un et de l’autre."
L4_CH_05,nous,trouverons,trouver,5.85,NAN,"que quand nous formons en nous - mêmes quelques Propositions sur le Blanc ou le Noir , sur le Doux ou l’ Amer , sur un Triangle ou un Cercle , nous pouvons former dans notre Esprit des Idées mêmes","que quand nous former en nous - même quelque proposition sur le blanc ou le noir , sur le Doux ou l’ Amer , sur un triangle ou un cercle , nous pouvoir former dans notre esprit un idée même","Car si nous observons soigneusement la manière dont notre Esprit se prend à penser et à raisonner, nous trouverons, à mon avis, que quand nous formons en nous-mêmes quelques Propositions sur le Blanc ou le Noir, sur le Doux ou l’Amer, sur un Triangle ou un Cercle, nous pouvons former dans notre Esprit des Idées mêmes ;"
L4_CH_05,nous,affirmons,affirmer,nan,NAN,qu’ il n’ est aisé de l’ expliquer par des paroles,qu’ il n’ être aisé de l’ expliquer par un parole,"Mais cette action de l’Esprit qui est si familiere à tout homme qui pense et qui raisonne, est plus facile à concevoir en reflechissant sur ce qui se passe en nous, lorsque nous affirmons ou nions, qu’il n’est aisé de l’expliquer par des paroles."
L4_CH_06,nous,voyons,voir,5,NAN,"que les Idées que ces termes signifient , conviennent ou ne conviennent pas","que le idée que ce terme signifier , convenir ou ne convenir pas","Et quand nous voyons que les Idées que ces termes signifient, conviennent ou ne conviennent pas, selon qu’ils sont affirmez ou niez l’un de l’autre, c’est alors que nous sommes certains de la vérité ou de la fausseté de ces Propositions."
L4_CH_07,nous,reconnaîtrons,reconnaître,6.85,NAN,"que non seulement ce peu de Propositions qui ont passé pour Maximes sont évidentes par elles - mêmes , mais que quantité , ou plûtôt une infinité d’ autres Propositions le sont aussi","que non seulement ce peu de proposition qui avoir passer pour maxime être évident par lui - même , mais que quantité , ou plûtôt un infinité d’ autre proposition le être aussi","par où nous reconnaîtrons que non seulement ce peu de Propositions qui ont passé pour Maximes sont évidentes par elles-mêmes, mais que quantité, ou plûtôt une infinité d’autres Propositions le sont aussi."
L4_CH_07,nous,trouverons,trouver,5.85,NAN,"que les Idées générales sont des fictions de l’ Esprit qu’ on peut former sans quelque peine , et qui ne se présentent pas si aisément que nous sommes portés à nous le figurer","que le idée général être un fiction de l’ esprit qu’ on pouvoir former sans quelque peine , et qui ne se présenter pas si aisément que nous être porter à nous le figurer","car si nous les considerons exactement, nous trouverons que les Idées générales sont des fictions de l’Esprit qu’on peut former sans quelque peine, et qui ne se présentent pas si aisément que nous sommes portés à nous le figurer."
L4_CH_07,Je,sais,savoir,8.65,bien,"que sur la foi des Scholastiques , on parle beaucoup de Sciences , et des Maximes , sur qui ces Sciences sont fondées","que sur le foi de scholastique , on parler beaucoup de science , et de maxime , sur qui ce science être fonder","Je sais bien que sur la foi des Scholastiques, on parle beaucoup de Sciences, et des Maximes, sur qui ces Sciences sont fondées."
L4_CH_07,j’,voir,voir,5,déjà,que c’ est -là une grande erreur,que c’ être -là un grand erreur,Mais j’ai déjà fait voir que c’est-là une grande erreur.
L4_CH_07,nous,verrons,voir,5,NAN,que tant que la Démonstration dépendra de ces Principes,que tant que le démonstration dépendre de ce principe,"Par exemple, que l’homme soit le sujet sur lequel on veut démontrer quelque chose par le moyen de ces premiers Principes, et nous verrons que tant que la Démonstration dépendra de ces Principes, elle ne sera que verbale, et ne nous fournira aucune Proposition certaine, véritable, et universelle, ni aucune connaissance de quelque Etre existant hors de nous."
L4_CH_08,nous,trouverons,trouver,5.85,peut-être,"qu’ il y en a beaucoup plus qu’ on ne croit communément qui ne roulent que sur la signification des mots , et qui ne renferment rien que l’ usage et l’ application de ces signes","qu’ il y en avoir beaucoup plus qu’ on ne croire communément qui ne rouler que sur le signification de mot , et qui ne renfermer rien que l’ usage et l’ application de ce signe","Si nous examinons sur ces deux Règles les Propositions qui composent les Discours écrits ou non écrits, nous trouverons peut-être qu’il y en a beaucoup plus qu’on ne croit communément qui ne roulent que sur la signification des mots, et qui ne renferment rien que l’usage et l’application de ces signes."
L4_CH_09,nous,apercevons,apercevoir,nan,tant,que la chose n’ a pas besoin et n’ est point capable d’ être démontrée par aucune preuve,que le chose n’ avoir pas besoin et n’ être point capable d’ être démontrer par aucun preuve,"Pour ce qui est de notre existence, nous l’apercevons avec tant d’évidence et de certitude, que la chose n’a pas besoin et n’est point capable d’être démontrée par aucune preuve."
L4_CH_10,nous,trouverons,trouver,5.85,NAN,qu’ elle est incapable,qu’ lui être incapable,"En effet, supposons une partie de Matière, grosse ou petite, qui existe de toute éternité, nous trouverons qu’elle est incapable de rien produire par elle-même."
L4_CH_10,Je,suppose,supposer,3.29,NAN,qu’ ils feront difficulté de le dire,qu’ il faire difficulté de le dire,Je suppose qu’ils feront difficulté de le dire ;
L4_CH_11,je,connais,connaître,7,NAN,"que cette Qualité ou cet Accident , dont l’ apparence étant devant mes yeux produit toûjours cette idée , existe réellement et hors de moi","que ce qualité ou ce accident , dont l’ apparence être devant mon oeil produire toûjours ce idée , exister réellement et hors de moi","et par-là je connais que cette Qualité ou cet Accident, dont l’apparence étant devant mes yeux produit toûjours cette idée, existe réellement et hors de moi."
L4_CH_11,je,vois,voir,5,NAN,"que je puis changer les apparences du Papier , et en traçant des Lettres","que je pouvoir changer le apparence de papier , et en tracer un lettre","Ainsi en écrivant ceci je vois que je puis changer les apparences du Papier, et en traçant des Lettres, dire d’avance quelle nouvelle Idée il présentera à l’Esprit dans le moment immédiatement suivant, par quelques traits que j’y ferai avec la plume ;"
L4_CH_11,je,trouve,trouver,5.85,NAN,"que les caractères qui ont été tracez selon la fantaisie de mon Esprit , ne dépendent plus de cette fantaisie , et ne cessent pas d’ être , dès que je viens à me figurer qu’ ils ne sont plus","que le caractère qui avoir être tracer selon le fantaisie de mon esprit , ne dépendre plus de ce fantaisie , et ne cesser pas d’ être , dès que je venir à me figurer qu’ il ne être plus","D’où il s’ensuit visiblement que ce n’est pas un simple jeu de mon Imagination, puisque je trouve que les caractères qui ont été tracez selon la fantaisie de mon Esprit, ne dépendent plus de cette fantaisie, et ne cessent pas d’être, dès que je viens à me figurer qu’ils ne sont plus"
L4_CH_11,nous,connaissons,connaître,7,NAN,qu’ un Objet existe lorsqu’ il frappe actuellement nos Sens,qu’ un objet exister lorsqu’ il frappe actuellement notre sens,"Comme nous connaissons qu’un Objet existe lorsqu’il frappe actuellement nos Sens, nous pouvons de même être assurés par le moyen de notre Mémoire que les choses dont nos Sens ont été affectez, ont existé auparavant."
L4_CH_11,je,connais,connaître,7,certainement,"que l’ Eau existe présentement , que ces Bulles ou ces Couleurs","que l’ eau exister présentement , que ce bulle ou ce couleur","Mais à cette heure que je suis éloigné de la vue de l’Eau et de ces Bulles, je ne connais pas plus certainement que l’Eau existe présentement, que ces Bulles ou ces Couleurs ;"
L4_CH_11,nous,sachions,savoir,8.65,NAN,qu’ elles y sont actuellement,qu’ lui y être actuellement,"Mais quoi que nous ayions ces Idées dans l’Esprit, et que nous sachions qu’elles y sont actuellement, cependant ce que nous avons ces idées ne nous fait pas connaître qu’aucune telle chose existe hors de nous, ou qu’il y ait aucuns Esprits finis, ni aucun autre Etre spirituel que Dieu."
L4_CH_12,je,crois,croire,5.03,NAN,que quiconque considérera la chose avec soin,que quiconque considérer le chose avec soin,"Mais je crois que quiconque considérera la chose avec soin, avouera que les grands progrès et la certitude de la Connaissance réelle où les hommes parviennent dans les Mathematiques, ne doivent point être attribuez à l’influence de ces Principes, et ne procèdent point de quelque avantage particulier que produisent deux ou trois Maximes générales qu’ils ont posé au commencement, mais des idées claires, distinctes, et complètes qu’ils ont dans l’Esprit, et du rapport d’égalité et d’inégalité qui est si évident entre quelques-unes de ces Idées, qu’ils le connaissent intuïtivement, par où ils ont un moyen de découvrir dans d’autres idées, et cela sans le secours de ces Maximes."
L4_CH_15,nous,connaissions,connaître,7,NAN,qu’ elles le soient,qu’ lui le être,"Parce qu’elle nous fait présumer que les choses sont véritables, avant que nous connaissions qu’elles le soient."
L4_CH_15,nous,connaissions,connaître,7,certainement,qu’ elles le sont,qu’ lui le être,"Ainsi, la Probabilité étant destinée à suppléer au défaut de notre Connaissance et à nous servir de guide dans les endroits où la Connaissance nous manque, elle roule toûjours sur des Propositions que quelques motifs nous portent à recevoir pour véritables sans que nous connaissions certainement qu’elles le sont."
L4_CH_16,je,trouve,trouver,5.85,NAN,qu’ une chose est la plûpart du temps telle que l’ exemple,qu’ un chose être le plûpart de temps tel que l’ exemple,"Le dégré suivant de Probabilité, c’est lorsque je trouve par ma propre expérience et par le rapport unanime de tous les autres hommes qu’une chose est la plûpart du temps telle que l’exemple, l’Histoire nous apprenant dans tous les âges, et ma propre expérience me confirmant autant que j’ai occasion de l’observer, que la plûpart des hommes préferent leur intérêt particulier à celui du Public, si tous les Historiens qui ont écrit de Tibere, disent que Tibere en a usé ainsi"
L4_CH_16,je,trouve,trouver,5.85,NAN,que la plûpart des hommes préferent leur intérêt particulier à celui du Public,que le plûpart de homme préferer son intérêt particulier à celui de public,"Le dégré suivant de Probabilité, c’est lorsque je trouve par ma propre expérience et par le rapport unanime de tous les autres hommes qu’une chose est la plûpart du temps telle que l’exemple, l’Histoire nous apprenant dans tous les âges, et ma propre expérience me confirmant autant que j’ai occasion de l’observer, que la plûpart des hommes préferent leur intérêt particulier à celui du Public, si tous les Historiens qui ont écrit de Tibere, disent que Tibere en a usé ainsi"
L4_CH_16,je,pense,penser,5.46,NAN,qu’ il ne sera pas hors de propos,qu’ il ne être pas hors de propos," : sur quoi je pense qu’il ne sera pas hors de propos de prendre connaissance d’une Règle observée dans la Loi d’Angleterre, qui est que, quoi que la Copie d’un Acte, reconnue authentique par des Témoins, soit une bonne preuve, cependant la copie d’une Copie, quelque bien attestée qu’elle soit et par les témoins les plus accrédités, n’est jamais admise pour preuve en Jugement."
L4_CH_16,je,trouve,trouver,5.85,NAN,qu’ on en use ordinairement d’ une manière directement contraire parmi certaines gens chez qui les Opinions acquièrent de nouvelles forces en vieillissant,qu’ on en user ordinairement d’ un manière directement contraire parmi certain gens chez qui le opinion acquérir de nouveau force en vieillir,"J’ai crû qu’il était nécessaire de faire cette remarque, parce que je trouve qu’on en use ordinairement d’une manière directement contraire parmi certaines gens chez qui les Opinions acquièrent de nouvelles forces en vieillissant, de sorte qu’une chose qui n’aurait point du tout paru probable il y a mille ans à un homme raisonnable, contemporain de celui qui la certifia le prémier, passe présentement dans leur Esprit pour certaine et tout-à-fait indubitable, parce que depuis ce temps-là plusieurs personnes l’ont rapportée sur son témoignage les uns après les autres."
L4_CH_16,Nous,voyons,voir,5,NAN,"que les Animaux sont engendrés , nourris , et qu’ ils se meuvent , que l’ Aimant attire le Fer , et que les parties d’ une Chandelle venant à se fondre successivement , se changent en flamme , et nous donnent de la lumière et de la chaleur","que le animal être engendrer , nourrir , et qu’ il se mouvoir , que l’ aimant attirer le fer , et que le party d’ un chandelle venir à se fondre successivement , se changer en flamme , et nous donner de le lumière et de le chaleur","Nous voyons que les Animaux sont engendrés, nourris, et qu’ils se meuvent, que l’Aimant attire le Fer, et que les parties d’une Chandelle venant à se fondre successivement, se changent en flamme, et nous donnent de la lumière et de la chaleur."
L4_CH_16,nous,croyons,croire,5.03,NAN,"qu’ il est probable que la couleur et l’ éclat des Corps n’ est autre chose de la part des Corps , que le différent arrangement et la refraction de leurs particules insensibles","qu’ il être probable que le couleur et l’ éclat de corps n’ être autre chose de le part de corps , que le différent arrangement et le refraction de leur particule insensible","observant de même que les différentes refractions des Corps pellucides excitent dans nos yeux différentes apparences de plusieurs Couleurs, comme aussi que la diverse position et le différent arrangement des parties qui composent la surface de différens Corps comme du Velours, de la soye façonnée en ondes, etcetera, produit le même effet, nous croyons qu’il est probable que la couleur et l’éclat des Corps n’est autre chose de la part des Corps, que le différent arrangement et la refraction de leurs particules insensibles."
L4_CH_17,nous,trouverons,trouver,5.85,NAN,"que nous raisonnons mieux et plus clairement lorsque nous observons seulement la connexion des preuves , sans réduire nos pensées à aucune règle ou forme Syllogistique","que nous raisonner mieux et plus clairement lorsque nous observer seulement le connexion de preuve , sans réduire notre pensée à aucun règle ou forme syllogistique","Si nous faisons reflexion sur les actions de notre Esprit, nous trouverons que nous raisonnons mieux et plus clairement lorsque nous observons seulement la connexion des preuves, sans réduire nos pensées à aucune règle ou forme Syllogistique."
L4_CH_17,je,crois,croire,5.03,NAN,"que chacun reconnaîtra sans peine dans les Démonstrations Mathematiques ,","que chacun reconnaître sans peine dans le démonstration mathematique ,","et je crois que chacun reconnaîtra sans peine dans les Démonstrations Mathematiques, que la connaissance qu’on acquiert par cet ordre naturel ; paraît plûtôt et plus clairement sans le recours d’aucun syllogisme."
L4_CH_17,je,crois,croire,5.03,NAN,que la connaissance qu’ on acquiert par cet ordre naturel   ;,que le connaissance qu’ on acquérir par ce ordre naturel   ;,"et je crois que chacun reconnaîtra sans peine dans les Démonstrations Mathematiques, que la connaissance qu’on acquiert par cet ordre naturel ; paraît plûtôt et plus clairement sans le recours d’aucun syllogisme."
L4_CH_17,j’,trouvé,trouver,5.85,NAN,"qu’ en rangeant les Idées moyennes toutes nues dans leur ordre naturel , on voit mieux l’ incohérence de l’ Argumentation que par le moyen d’ un syllogisme","qu’ en ranger le idée moyen tout nu dans son ordre naturel , on voir mieux l’ incohérence de l’ argumentation que par le moyen d’ un syllogisme","J’ai été moi-même dans ce sentiment, jusqu’à ce qu’après un plus sévére examen j’ai trouvé qu’en rangeant les Idées moyennes toutes nues dans leur ordre naturel, on voit mieux l’incohérence de l’Argumentation que par le moyen d’un syllogisme ;"
L4_CH_18,Je,trouve,trouver,5.85,NAN,que dans chaque Secte on se sert avec plaisir de la Raison autant qu’ on en peut tirer quelque secours  ,que dans chaque secte on se servir avec plaisir de le raison autant qu’ on en pouvoir tirer quelque secours  ,Je trouve que dans chaque Secte on se sert avec plaisir de la Raison autant qu’on en peut tirer quelque secours ;
L4_CH_18,je,suppose,supposer,3.29,NAN,"que c’ est la découverte de la certitude ou de la probabilité des Propositions ou Vérités que l’ Esprit vient à connaître par des déductions tirées d’ Idées qu’ il a acquises par l’ usage de ses Facultés naturelles , c’ est - à - dire , par Sensation ou par Reflexion","que c’ être le découverte de le certitude ou de le probabilité de proposition ou vérité que l’ esprit venir à connaître par un déduction tirer d’ idée qu’ il avoir acquérir par l’ usage de son faculté naturel , c’ est - à - dire , par sensation ou par reflexion","Considerant donc ici la Raison comme distincte de la Foi, je suppose que c’est la découverte de la certitude ou de la probabilité des Propositions ou Vérités que l’Esprit vient à connaître par des déductions tirées d’Idées qu’il a acquises par l’usage de ses Facultés naturelles, c’est-à-dire, par Sensation ou par Reflexion."
