Divs,Source,VAP,Lemma,VAP_values,ADV,Target,Target_lemma,Phrase Complete
L1_CH_01,Je,reconnais,reconnaître,6.85,donc,"qu’ il faut nécessairement que les Hommes fassent usage de leur Raison , avant que de parvenir à la connaissance de ces vérités générales","qu’ il falloir nécessairement que le homme faire usage de son raison , avant que de parvenir à le connaissance de ce vérité général","Je reconnais donc qu’il faut nécessairement que les Hommes fassent usage de leur Raison, avant que de parvenir à la connaissance de ces vérités générales : mais encore un coup, je nie que le temps auquel ils commencent à se servir de leur Raison, soit justement celui auquel ils viennent à découvrir ces vérités."
L1_CH_01,je,nie,nier,nan,donc,"que le temps auquel ils commencent à se servir de leur Raison , soit justement celui auquel ils viennent à découvrir ces vérités .","que le temps auquel il commencer à se servir de son raison , être justement celui auquel il venir à découvrir ce vérité .","Je reconnais donc qu’il faut nécessairement que les Hommes fassent usage de leur Raison, avant que de parvenir à la connaissance de ces vérités générales : mais encore un coup, je nie que le temps auquel ils commencent à se servir de leur Raison, soit justement celui auquel ils viennent à découvrir ces vérités."
L1_CH_01,je,nie,nier,nan,NAN,qu’ il s’ ensuivît de là qu’ elles fussent innées,qu’ il s’ ensuivre de là qu’ lui être inné,"et quand cela serait, je nie qu’il s’ensuivît de là qu’elles fussent innées."
L1_CH_01,nous,trouverons,trouver,5.85,NAN,"que ces sortes de vérités sont composées d’ idées qui ne sont nullement innées , mais acquises","que ce sorte de vérité être composer d’ idée qui ne être nullement inné , mais acquérir","En effet, si nous y prenons garde, nous trouverons que ces sortes de vérités sont composées d’idées qui ne sont nullement innées, mais acquises :"
L1_CH_01,je,reconnais,reconnaître,6.85,NAN,que nous pouvons tous tomber,que nous pouvoir tout tomber,"Inconvenient, dans lequel je reconnais que nous pouvons tous tomber, lors que nous nous échauffons la tête à force de penser à quelque sujet avec trop d’application."
L1_CH_01,je,suppose,supposer,3.29,NAN,qu’ il n’ y a point d’ autre Maxime de pure spéculation qu’ on ait droit de faire passer pour innée,qu’ il n’ y avoir point d’ autre maxime de pur spéculation qu’ on avoir droit de faire passer pour inné,"Or si ces deux célèbres Principes spéculatifs ne sont point innés, je suppose, sans qu’il soit nécessaire de le prouver, qu’il n’y a point d’autre Maxime de pure spéculation qu’on ait droit de faire passer pour innée."
L1_CH_02,nous,trouverons,trouver,5.85,NAN,"qu’ en eux - mêmes ils n’ ont point tant de respect pour ces sortes de Règles , ni une fort grande persuasion de leur certitude , et de l’ obligation où ils sont de les observer","qu’ en lui - même il n’ avoir point tant de respect pour ce sorte de règle , ni un fort grand persuasion de son certitude , et de l’ obligation où il être de le observer","En effet, si nous ne voulons par civilité attribuer à la plûpart des hommes plus de sincerité qu’ils n’en ont effectivement, mais que nous regardions leurs actions comme les interprêtes de leurs pensées, nous trouverons qu’en eux-mêmes ils n’ont point tant de respect pour ces sortes de Règles, ni une fort grande persuasion de leur certitude, et de l’obligation où ils sont de les observer."
L1_CH_02,nous,trouverons,trouver,5.85,Enfin,"qu’ en un Lieu ils font scrupule de faire , ou de négliger certaines choses , pendant qu’ ailleurs d’ autres croient mériter récompense en s’ abstenant des mêmes choses que ceux -là font par un motif de conscience , ou en faisant ce que ces premiers n’ oseraient faire","qu’ en un lieu il faire scrupule de faire , ou de négliger certain chose , pendant qu’ ailleurs d’ autre croire mériter récompense en s’ abstenir de même chose que celui -là faire par un motif de conscience , ou en faire ce que ce premier n’ oser faire","Enfin, si nous jettons les yeux hors de chez-nous, pour voir ce qui se passe dans le reste du Monde, et considérer les hommes tels qu’ils sont effectivement, nous trouverons qu’en un Lieu ils font scrupule de faire, ou de négliger certaines choses, pendant qu’ailleurs d’autres croient mériter récompense en s’abstenant des mêmes choses que ceux-là font par un motif de conscience, ou en faisant ce que ces premiers n’oseraient faire."
L1_CH_03,Je,suppose,supposer,3.29,NAN,qu’ on le met au nombre des Principes innés,qu’ on le mettre au nombre de principe inné,"Je suppose qu’on le met au nombre des Principes innés, et je suis assuré qu’il peut y être mis avec autant de raison, qu’aucun autre Principe que ce"
L1_CH_03,J’,trouvé,trouver,5.85,NAN,que cette Nation n’ a aucun mot qui signifie Dieu et l’ Ame de l’ Homme,que ce nation n’ avoir aucun mot qui signifier dieu et l’ ame de l’ homme,"c’est-à-dire, « J’ai trouvé que cette Nation n’a aucun mot qui signifie Dieu et l’Ame de l’Homme ;"
L1_CH_03,nous,voyons,voir,5,NAN,"que , parce que cette idée ne nous vient pas par les mêmes voyes que les autres idées , nous ne la connaissons point du tout , d’ une manière distincte   : de sorte que le mot de Substance n’ emporte autre chose à notre égard , qu’ un certain sujet indéterminé que nous ne connaissons point ,","que , parce que ce idée ne nous venir pas par le même voye que le autre idée , nous ne le connaître point de tout , d’ un manière distinct   : de sorte que le mot de substance n’ emporter autre chose à notre égard , qu’ un certain sujet indéterminé que nous ne connaître point ,","Mais nous voyons au contraire, que, parce que cette idée ne nous vient pas par les mêmes voyes que les autres idées, nous ne la connaissons point du tout, d’une manière distincte : de sorte que le mot de Substance n’emporte autre chose à notre égard, qu’un certain sujet indéterminé que nous ne connaissons point,"
L1_CH_03,je,vois,voir,5,bien,que rien n’ était plus court et plus aisé que de conclure que ces Propositions étaient innées,que rien n’ être plus court et plus aisé que de conclure que ce proposition être inné,"Les hommes ayant une fois trouvé certaines Propositions générales, qu’on ne saurait révoquer en doute, dès qu’on les comprend, je vois bien que rien n’était plus court et plus aisé que de conclure que ces Propositions étaient innées."
L2_CH_01,nous,trouverons,trouver,5.85,NAN,que c’ est à quoi se reduisent toutes nos idées,que c’ être à quoi se reduiser tout notre idée,"Si nous faisons une exacte revue de toutes ces idées, et de leurs differens modes, combinaisons, et relations, nous trouverons que c’est à quoi se reduisent toutes nos idées ; et que nous n’avons rien dans l’Esprit qui n’y vienne par l’une de ces deux voyes."
L2_CH_01,Nous,savons,savoir,8.65,certainement,que nous pensons quelquefois,que nous penser quelquefois,Nous savons certainement par expérience que nous pensons quelquefois ;
L2_CH_01,Je,vois,voir,5,donc,que l’ Ame pense avant que les Sens lui ayent fourni des idées pour être l’ objet de ses pensées,que l’ Ame penser avant que le sens luire ayent fournir un idée pour être l’ objet de son pensée,"Je ne vois donc aucune raison de croire, que l’Ame pense avant que les Sens lui ayent fourni des idées pour être l’objet de ses pensées ;"
L2_CH_01,je,conçois,concevoir,6,NAN,"que l’ Entendement commence à recevoir des Idées , justement dans le temps qu’ il vient à recevoir des sensations , et par conséquent que les idées commencent d’ y être produites dans le même temps que la sensation , qui est une impression , ou un mouvement excité dans quelque partie du Corps , qui produit quelque perception dans l’ Entendement","que l’ entendement commencer à recevoir un idée , justement dans le temps qu’ il venir à recevoir un sensation , et par conséquent que le idée commencer d’ y être produire dans le même temps que le sensation , qui être un impression , ou un mouvement exciter dans quelque partie de corps , qui produire quelque perception dans l’ entendement","Car puisqu’il ne paraît aucune idée dans l’Ame, avant que les Sens y en ayent introduit, je conçois que l’Entendement commence à recevoir des Idées, justement dans le temps qu’il vient à recevoir des sensations, et par conséquent que les idées commencent d’y être produites dans le même temps que la sensation, qui est une impression, ou un mouvement excité dans quelque partie du Corps, qui produit quelque perception dans l’Entendement."
L2_CH_04,nous,éprouvons,éprouver,8,NAN,"que , tandis qu’ ils sont entre nos mains , ils empêchent , par une force invincible , l’ approche des parties de nos mains qui les pressent","que , tandis qu’ il être entrer notre main , il empêcher , par un force invincible , l’ approche de party de notre main qui le pressentir","et nous éprouvons tous les jours en maniant des Corps, que, tandis qu’ils sont entre nos mains, ils empêchent, par une force invincible, l’approche des parties de nos mains qui les pressent."
L2_CH_04,nous,concevons,concevoir,6,NAN,"que le Corps remplit l’ Espace   : autre idée qui emporte , que par tout où nous concevons que cette substance occupe de telle sorte cet espace , qu’ elle en exclut toute autre substance solide  ","que le corps remplir l’ espace   : autre idée qui emporter , que par tout où nous concevoir que ce substance occuper de tel sorte ce espace , qu’ lui en exclure tout autre substance solide  ","Or par cette idée qui appartient au Corps, nous concevons que le Corps remplit l’Espace : autre idée qui emporte, que par tout où nous concevons que cette substance occupe de telle sorte cet espace, qu’elle en exclut toute autre substance solide ;"
L2_CH_04,nous,concevons,concevoir,6,NAN,"que cette substance occupe de telle sorte cet espace , qu’ elle en exclut toute autre substance solide","que ce substance occuper de tel sorte ce espace , qu’ lui en exclure tout autre substance solide","Or par cette idée qui appartient au Corps, nous concevons que le Corps remplit l’Espace : autre idée qui emporte, que par tout où nous concevons que cette substance occupe de telle sorte cet espace, qu’elle en exclut toute autre substance solide ;"
L2_CH_08,nous,jugeons,juger,7.4,NAN,"que la blancheur et la mollesse sont produites dans la Cire non comme des Qualités qui existent actuellement dans le Soleil , mais comme des effets de puissance qu’ il a d’ amollir et de blanchir","que le blancheur et le mollesse être produire dans le cire non comme un qualité qui exister actuellement dans le soleil , mais comme un effet de puissance qu’ il avoir d’ amollir et de blanchir","Mais lors que nous considerons le Soleil par rapport à la Cire qu’il amollit ou blanchit, nous jugeons que la blancheur et la mollesse sont produites dans la Cire non comme des Qualités qui existent actuellement dans le Soleil, mais comme des effets de puissance qu’il a d’amollir et de blanchir."
L2_CH_08,nous,voyons,voir,5,clairement,que la Qualité qui est produite par ce changement,que le qualité qui être produire par ce changement,"Au contraire, dans l’autre cas, je veux dire dans les opérations d’un Corps sur un autre Corps, dont ils altèrent les Qualités, nous voyons clairement que la Qualité qui est produite par ce changement, n’a ordinairement aucune ressemblance avec quoi que ce soit qui existe dans le Corps qui vient de produire cette nouvelle qualité."
L2_CH_08,nous,voyons,voir,5,cependant,que la Cire ou un beau visage reçoivent du Soleil un changement de couleur,que le Cire ou un beau visage recevoir de soleil un changement de couleur,"Car bien qu’en recevant du Soleil l’idée de la chaleur, ou de la lumière, nous soyons portés à croire que c’est une perception et une ressemblance d’une pareille qualité qui existe dans le Soleil, cependant lorsque nous voyons que la Cire ou un beau visage reçoivent du Soleil un changement de couleur, nous ne saurions nous figurer, que ce soit une émanation, ou ressemblance d’une pareille chose qui soit actuellement dans le Soleil, parce que nous ne trouvons point ces différentes couleurs dans le Soleil même."
L2_CH_10,nous,voyons,voir,5,souvent,"qu’ une Maladie dépouille l’ Ame de toutes ses idées , et qu’ une Fièvre ardente confond en peu de jours et réduit en poudre toutes ces images qui semblaient devoir durer aussi long - temps que si elles eussent été gravées dans le Marbre","qu’ un maladie dépouille l’ ame de tout son idée , et qu’ un fièvre ardent confondre en peu de jour et réduire en poudre tout ce image qui sembler devoir durer aussi long - temps que si lui avoir être graver dans le marbre","De savoir quelle part a à tout cela la consitution de nos Corps et l’action des Esprits animaux, et si le temperament du cerveau produit cette difference, en sorte que dans les uns il conserve comme le Marbre, les traces qu’il a reçues, en d’autres comme une pierre de taille, et en d’autres à peu près comme une couche de sable, c’est ce que je ne prétends pas examiner ici : quoi qu’il puisse paraître assez probable que la constitution du Corps a quelquefois de l’influence sur la Mémoire, puisque nous voyons souvent qu’une Maladie dépouille l’Ame de toutes ses idées, et qu’une Fièvre ardente confond en peu de jours et réduit en poudre toutes ces images qui semblaient devoir durer aussi long-temps que si elles eussent été gravées dans le Marbre."
L2_CH_11,Je,suppose,supposer,3.29,encore,que dans ce point les Bêtes sont inférieures aux Hommes,que dans ce point le bête être inférieur à homme,"Je suppose encore, que dans ce point les Bêtes sont inférieures aux Hommes."
L2_CH_12,nous,trouverons,trouver,5.85,NAN,"que les Idées même les plus abstruses , quelque éloignées qu’ elles paraissent des Sens ou d’ aucune opération de notre propre Entendement , ne sont pourtant que des notions que l’ Entendement se forme en repetant et combinant les Idées qu’ il avait reçues des Objets des Sens , ou de ses propres Opérations concernant les Idées qui lui ont été fournies par les Sens","que le idée même le plus abstrus , quelque éloigné qu’ lui paraître de sens ou d’ aucun opération de notre propre entendement , ne être pourtant que un notion que l’ entendement se forme en repeter et combiner le idée qu’ il avoir recevoir de objet de sens , ou de son propre opération concerner le idée qui luire avoir être fournir par le sens","Et si nous observons soigneusement les origines de nos Idées, nous trouverons, à mon avis, que les Idées même les plus abstruses, quelque éloignées qu’elles paraissent des Sens ou d’aucune opération de notre propre Entendement, ne sont pourtant que des notions que l’Entendement se forme en repetant et combinant les Idées qu’il avait reçues des Objets des Sens, ou de ses propres Opérations concernant les Idées qui lui ont été fournies par les Sens."
L2_CH_13,je,suppose,supposer,3.29,NAN,que cet homme est en vie avec la même puissance de mouvoir les parties de son Corps qu’ il a présentement,que ce homme être en vie avec le même puissance de mouvoir le party de son corps qu’ il avoir présentement,"Que s’il ne pouvait étendre sa main, ce devrait être à cause de quelque empêchement extérieur, car je suppose que cet homme est en vie avec la même puissance de mouvoir les parties de son Corps qu’il a présentement, ce qui de soi n’est pas impossible, si Dieu le veut ainsi, ou du moins est-il certain que Dieu peut le mouvoir en ce sens : et alors je demande si ce qui empêche sa main de se mouvoir en dehors, est substance ou accident, quelque chose, ou rien"
L2_CH_13,Je,suppose,supposer,3.29,NAN,"que personne ne me niera que Dieu ne puisse faire cesser tout le mouvement qui est dans la Matière , et mettre tous les Corps de l’ Univers dans un parfait repos , pour les laisser dans cet état tout aussi long - temps qu’ il voudra","que personne ne me nier que Dieu ne pouvoir faire cesser tout le mouvement qui être dans le matière , et mettre tout le corps de l’ univers dans un parfait repos , pour le laisser dans ce état tout aussi long - temps qu’ il vouloir","Je suppose que personne ne me niera que Dieu ne puisse faire cesser tout le mouvement qui est dans la Matière, et mettre tous les Corps de l’Univers dans un parfait repos, pour les laisser dans cet état tout aussi long-temps qu’il voudra."
L2_CH_14,nous,trouverons,trouver,5.85,NAN,que l’ idée de l’ Eternité elle-même découle de la même source d’ où viennent toutes nos autres Idées,que l’ idée de l’ eternité lui-même découler de le même source d’ où venir tout notre autre idée,et nous trouverons que l’idée de l’Eternité elle-même découle de la même source d’où viennent toutes nos autres Idées.
L2_CH_14,nous,connaissons,connaître,7,NAN,que nous existons,que nous exister,"Car tandis que nous pensons, ou que nous recevons successivement plusieurs idées dans notre Esprit, nous connaissons que nous existons"
L2_CH_14,Nous,voyons,voir,5,NAN,"que , lors qu’ une personne fixe ses pensées avec une extrême application sur une seule chose , en sorte qu’ il ne songe presque point à cette suite d’ idées qui se succèdent les unes aux autres dans son Esprit , il laisse échapper , sans y faire réflexion , une bonne partie de la Durée qui s’ écoule pendant tout le temps qu’ il est dans cette forte contemplation , s’ imaginant que ce temps -là est beaucoup plus court , qu’ il ne l’ est effectivement","que , lors qu’ un personne fixe son pensée avec un extrême application sur un seul chose , en sorte qu’ il ne songer presque point à ce suite d’ idée qui se succéder le une à autre dans son esprit , il laisse échapper , sans y faire réflexion , un bon partie de le durée qui s’ écouler pendant tout le temps qu’ il être dans ce fort contemplation , s’ imaginer que ce temps -là être beaucoup plus court , qu’ il ne l’ être effectivement","Nous voyons, tous les jours, que, lors qu’une personne fixe ses pensées avec une extrême application sur une seule chose, en sorte qu’il ne songe presque point à cette suite d’idées qui se succèdent les unes aux autres dans son Esprit, il laisse échapper, sans y faire réflexion, une bonne partie de la Durée qui s’écoule pendant tout le temps qu’il est dans cette forte contemplation, s’imaginant que ce temps-là est beaucoup plus court, qu’il ne l’est effectivement."
L2_CH_14,nous,apercevons,apercevoir,nan,NAN,"que ce Corps s’ est mû , mais sans que nous ayions aucune perception du mouvement actuel","que ce corps s’ être mouvoir , mais sans que nous ayier aucun perception de mouvement actuel","et par plusieurs autres mouvemens continus, mais fort lents, où après certains intervalles, nous apercevons par le changement de distance qui arrive au Corps en mouvement, que ce Corps s’est mû, mais sans que nous ayions aucune perception du mouvement actuel."
L2_CH_14,nous,voyons,voir,5,Ainsi,"que les Aveugles - nez comptent assez bien par années , dont ils ne peuvent pourtant pas distinguer les révolutions par des Mouvemens qu’ ils ne peuvent appercevoir","que le aveugle - nez compter assez bien par année , dont il ne pouvoir pourtant pas distinguer le révolution par un mouvemen qu’ il ne pouvoir appercevoir","Ainsi, nous voyons que les Aveugles-nez comptent assez bien par années, dont ils ne peuvent pourtant pas distinguer les révolutions par des Mouvemens qu’ils ne peuvent appercevoir."
L2_CH_14,nous,savons,savoir,8.65,certainement,que le milieu dans lequel le Pendule se meut,que le milieu dans lequel le pendule se mouvoir,"cependant si l’on demandoit à quelqu’un, comment il fait certainement que deux vibrations successives d’un Pendule sont égales, il aurait bien de la peine à se convaincre lui-même qu’elles le sont indubitablement, parce que nous ne pouvons point être assurez que la cause ce mouvement, qui nous est inconnue, opère toûjours également, et nous savons certainement que le milieu dans lequel le Pendule se meut, n’est pas constamment le même."
L2_CH_15,nous,supposons,supposer,3.29,communément,que l’ Expansion est un attribut,que l’ expansion être un attribut,"Mais comme nous n’attribuons pas l’étendue à Dieu, mais seulement à la Matière qui est finie, nous sommes plus sujets à douter de l’existence d’une Expansion sans Matière, de laquelle seule nous supposons communément que l’Expansion est un attribut."
L2_CH_17,nous,supposons,supposer,3.29,là,que l’ Esprit y trouve dequoi faire des progressions continuelles sans en pouvoir jamais remplir toute l’ idée,que l’ esprit y trouver dequoi faire un progression continuel sans en pouvoir jamais remplir tout l’ idée,"Mais lorsque nous supposons un reste inépuisable où nous ne concevons aucunes bornes, de sorte que l’Esprit y trouve dequoi faire des progressions continuelles sans en pouvoir jamais remplir toute l’idée, c’est là que nous trouvons notre idée de l’Infini."
L2_CH_17,nous,voyons,voir,5,NAN,"que nous avons une idée claire d’ une Durée infinie à venir , tout de même que d’ une Durée infinie déja passée , quoi qu’ il n’ y ait personne , à ce que je croi , qui s’ imagine qu’ on puisse concevoir qu’ une chose existe ou ait existé dans cette Durée à venir","que nous avoir un idée clair d’ un durée infini à venir , tout de même que d’ un durée infini déja passer , quoi qu’ il n’ y avoir personne , à ce que je croi , qui s’ imaginer qu’ on pouvoir concevoir qu’ un chose exister ou avoir exister dans ce durée à venir","Et pourquoi, je vous prie, nous irions-nous figurer que l’existence réelle de la Matière soit nécessaire pour soutenir notre Idée d’un Espace infini, puisque nous voyons que nous avons une idée claire d’une Durée infinie à venir, tout de même que d’une Durée infinie déja passée, quoi qu’il n’y ait personne, à ce que je croi, qui s’imagine qu’on puisse concevoir qu’une chose existe ou ait existé dans cette Durée à venir"
L2_CH_18,nous,voyons,voir,5,Ainsi,"qu’ il y a une grande diversité d’ Idées simples de Goûts , d’ Odeurs , etcetera , qui n’ ont point de nom","qu’ il y avoir un grand diversité d’ idée simple de goût , d’ odeur , etcetera , qui n’ avoir point de nom","Ainsi nous voyons qu’il y a une grande diversité d’Idées simples de Goûts, d’Odeurs, etcetera, qui n’ont point de nom"
L2_CH_20,je,remarquerais,remarquer,7,NAN,"que l’ Amour et la Haine que nous avons pour les choses inanimées et insensibles , sont ordinairement fondées sur le plaisir et la douleur que nous recevons de leur usage , et de l’ application qui en est faite sur nos Sens de quelque manière que ce soit , bien que ces choses soient détruites par cet usage même","que l’ amour et le haine que nous avoir pour le chose inanimé et insensible , être ordinairement fonder sur le plaisir et le douleur que nous recevoir de son usage , et de l’ application qui en être faire sur notre sens de quelque manière que ce être , bien que ce chose être détruire par ce usage même","Si c’était ici le lieu de porter mes recherches au delà des simples idées des Passions, entant qu’elles dépendent des différentes modifications du Plaisir et de la Douleur, je remarquerais que l’Amour et la Haine que nous avons pour les choses inanimées et insensibles, sont ordinairement fondées sur le plaisir et la douleur que nous recevons de leur usage, et de l’application qui en est faite sur nos Sens de quelque manière que ce soit, bien que ces choses soient détruites par cet usage même."
L2_CH_21,nous,voyons,voir,5,NAN,"qu’ en voulant simplement mouvoir des parties de notre Corps , qui étaient auparavant en repos , nous pouvons les mouvoir","qu’ en vouloir simplement mouvoir un party de notre corps , qui être auparavant en repos , nous pouvoir le mouvoir","Quant à l’idée du commencement du Mouvement, nous ne l’avons que par le moyen de la reflexion que nous faisons sur ce qui se passe en nous-mêmes, lorsque nous voyons par experience qu’en voulant simplement mouvoir des parties de notre Corps, qui étaient auparavant en repos, nous pouvons les mouvoir."
L2_CH_21,Je,nie,nier,nan,non,"que ces mots et autres semblables ne doivent avoir lieu dans l’ usage ordinaire des Langues , où ils sont communément reçus","que ce mot et autre semblable ne devoir avoir lieu dans l’ usage ordinaire de langue , où il être communément recevoir","Je ne nie pas non plus que ces mots et autres semblables ne doivent avoir lieu dans l’usage ordinaire des Langues, où ils sont communément reçus."
