Divs,Source,VAP,Lemma,VAP_values,ADV,Target,Target_lemma,Phrase Complete
L2_CH_21,nous,voyons,voir,5,Ainsi,"que le sage Auteur de notre Etre ayant égard à notre constitution , et sachant ce qui détermine notre Volonté , a mis dans les Hommes l’ incommodité de la faim et de la soif et des autres desirs naturels qui reviennent dans leur temps , afin d’ exciter et de déterminer leurs Volontés à leur propre conservation , et à la continuation de leur Espèce","que le sage auteur de notre etre avoir égard à notre constitution , et savoir ce qui déterminer notre volonté , avoir mettre dans le homme l’ incommodité de le faim et de le soif et de autre desir naturel qui revenir dans son temps , afin d’ exciter et de déterminer leur volonté à son propre conservation , et à le continuation de son espèce","Ainsi nous voyons que le sage Auteur de notre Etre ayant égard à notre constitution, et sachant ce qui détermine notre Volonté, a mis dans les Hommes l’incommodité de la faim et de la soif et des autres desirs naturels qui reviennent dans leur temps, afin d’exciter et de déterminer leurs Volontés à leur propre conservation, et à la continuation de leur Espèce."
L2_CH_21,je,pense,penser,5.46,NAN,"que bien des gens m’ excuseront plûtôt d’ avoir adopté cette Maxime , que de ce que je me hasarde présentement à m’ éloigner d’ une Opinion si généralement reçue","que bien un gens m’ excuser plûtôt d’ avoir adopter ce maxime , que de ce que je me hasarder présentement à m’ éloigner d’ un opinion si généralement recevoir","et je pense que bien des gens m’excuseront plûtôt d’avoir adopté cette Maxime, que de ce que je me hasarde présentement à m’éloigner d’une Opinion si généralement reçue."
L2_CH_21,nous,trouverons,trouver,5.85,NAN,"que , comme nous ne sommes capables que d’ une seule détermination de la Volonté vers une seule action à la fois , l’ inquiétude présente qui nous presse , détermine naturellement la Volonté en vue de ce bonheur auquel nous tendons tous dans toutes nos Actions","que , comme nous ne être capable que d’ un seul détermination de le volonté vers un seul action à le fois , l’ inquiétude présent qui nous presse , déterminer naturellement le volonté en vue de ce bonheur auquel nous tendre tout dans tout notre action","Si nous recherchons la raison de ce qu’ici l’Expérience vérifie avec tant d’évidence, et que nous examinions comment cette inquiétude opère toute seule sur la Volonté, et la détermine à prendre tel ou tel parti, nous trouverons, que, comme nous ne sommes capables que d’une seule détermination de la Volonté vers une seule action à la fois, l’inquiétude présente qui nous presse, détermine naturellement la Volonté en vue de ce bonheur auquel nous tendons tous dans toutes nos Actions."
L2_CH_21,nous,voyons,voir,5,pourtant,qu’ une grande et violente inquiétude s’ étant une fois emparée de la Volonté,qu’ un grand et violent inquiétude s’ être un fois emparer de le volonté,"Bien que nous reconnaissons d’une durée éternelle et d’une excellence indicible, et dont même notre Esprit a quelquefois été touché, ne fixe pas pour toûjours notre Volonté, nous voyons pourtant qu’une grande et violente inquiétude s’étant une fois emparée de la Volonté, ne lui donne aucun repit"
L2_CH_21,nous,trouverons,trouver,5.85,NAN,qu’ il n’ y a qu’ une très - petite portion de notre Vie qui soit assez exempte de ces sortes d’ inquiétudes pour nous laisser en liberté d’ être attirez par un Bien absent plus éloigné,qu’ il n’ y avoir qu’ un très - petit portion de notre vie qui être assez exempt de ce sorte d’ inquiétude pour nous laisser en liberté d’ être attirer par un bien absent plus éloigné,"Mode, l’Exemple ou l’Education nous rendent habituelles, et mille autres desirs irréguliers qui nous sont devenus naturels par la coutume, nous trouverons qu’il n’y a qu’une très-petite portion de notre Vie qui soit assez exempte de ces sortes d’inquiétudes pour nous laisser en liberté d’être attirez par un Bien absent plus éloigné."
L2_CH_21,nous,jugeons,juger,7.4,NAN,que ces choses ne sont pas capables de nous faire réellement autant de mal qu’ elles le font effectivement,que ce chose ne être pas capable de nous faire réellement autant de mal qu’ lui le faire effectivement,Lorsque nous jugeons que ces choses ne sont pas capables de nous faire réellement autant de mal qu’elles le font effectivement.
L2_CH_21,je,croyais,croire,5.03,NAN,qu’ elle me conduisait,qu’ lui me conduire,"Dans ce que j’écrivis d’abord, je suivis avec une entiére indifférence la Vérité, où je croyais qu’elle me conduisait."
L2_CH_22,nous,trouverons,trouver,5.85,NAN,qu’ elles ont une autre origine,qu’ lui avoir un autre origine,"Mais si nous examinons avec attention les Idées que j’appelle Mode Mixtes et dont nous parlons présentement, nous trouverons qu’elles ont une autre origine."
L2_CH_22,Nous,verrons,voir,5,même,que personne n’ a sujet de craindre de n’ avoir pas un champ assez vaste pour donner essor à ses pensées,que personne n’ avoir sujet de craindre de n’ avoir pas un champ assez vaste pour donner essor à son pensée,"Nous verrons même, avant que de finir cet Ouvrage, que personne n’a sujet de craindre de n’avoir pas un champ assez vaste pour donner essor à ses pensées ;"
L2_CH_23,nous,supposons,supposer,3.29,NAN,qu’ elles existent dans quelque sujet commun qui en est le soutien,qu’ lui exister dans quelque sujet commun qui en être le soutien,"Delà vient, que lorsque quelque Espèce particuliére de Substances corporelles, comme un Cheval, une Pierre, etcetera, vient à faire le sujet de notre entretien et de nos pensées, quoi que l’idée que nous avons de l’une ou de l’autre de ces choses ne soit qu’une combinaison ou collection de différentes Idées simples des Qualités sensibles que nous trouvons unies dans ce que nous appellons Cheval ou Pierre, cependant comme nous ne saurions concevoir que ces Qualités subsistent toutes seules, ou l’une dans l’autre, nous supposons qu’elles existent dans quelque sujet commun qui en est le soutien ;"
L2_CH_23,je,connais,connaître,7,NAN,qu’ il y a quelque Etre corporel hors de moi qui est l’ objet de cette sensation,qu’ il y avoir quelque etre corporel hors de moi qui être l’ objet de ce sensation,"Car dans le temps que voyant ou entendant, etcetera, je connais qu’il y a quelque Etre corporel hors de moi qui est l’objet de cette sensation, je sai d’une manière encore plus certaine qu’il y a au dedans de moi quelque Etre spirituel qui voit et qui entend."
L2_CH_23,je,trouve,trouver,5.85,NAN,que les Esprits non plus que les Corps ne sauraient operer qu’ où ils sont  ,que le esprit non plus que le corps ne savoir operer qu’ où il être  ,et que je trouve que les Esprits non plus que les Corps ne sauraient operer qu’où ils sont ; et que les Esprits operent en divers temps dans différens lieux
L2_CH_23,nous,trouverons,trouver,5.85,NAN,qu’ il s’ en faut de beaucoup que l’ idée que nous avons de l’ étendue du Corps soit plus claire que l’ idée que nous avons de la Pensée,qu’ il s’ en falloir de beaucoup que l’ idée que nous avoir de l’ étendue de corps être plus clair que l’ idée que nous avoir de le pensée,"Tant il est vrai que si nous voulons rechercher la nature, la cause et la manière de l’Etendue du Corps, qui n’est autre chose que la cohésion de parties solides, nous trouverons qu’il s’en faut de beaucoup que l’idée que nous avons de l’étendue du Corps soit plus claire que l’idée que nous avons de la Pensée."
L2_CH_23,nous,trouvons,trouver,5.85,NAN,que cette recherche ne sert qu’ à nous faire sentir combien sont courtes nos lumières,que ce recherche ne servir qu’ à nous faire sentir combien être court notre lumière,"Car dès que l’Esprit veut porter sa vue au delà de ces idées originales qui nous viennent par Sensation pour par Reflexion, pour pénétrer dans leurs causes et dans la manière de leur production, nous trouvons que cette recherche ne sert qu’à nous faire sentir combien sont courtes nos lumières."
L2_CH_23,nous,apercevons,apercevoir,nan,bientôt,que la nature de l’ Etendue ne nous est pas connue plus nettement que celle de la Pensée,que le nature de l’ etendue ne nous être pas connaître plus nettement que celui de le pensée,"Que si nous voulons rechercher, outre cela, leur nature, leurs causes, etcetera, nous apercevons bientôt que la nature de l’Etendue ne nous est pas connue plus nettement que celle de la Pensée."
L2_CH_23,nous,trouverons,trouver,5.85,NAN,"que nous l’ acquerons par la même voye , et que les Idées complexes que nous avons de Dieu et des Esprits purs , sont composées des idées simples que nous recevons de la Reflexion","que nous l’ acquerer par le même voye , et que le idée complexe que nous avoir de Dieu et de esprit pur , être composer de idée simple que nous recevoir de le reflexion","En effet, si nous examinons l’Idée que nous avons de cet Etre suprême et incompréhensible, nous trouverons que nous l’acquerons par la même voye, et que les Idées complexes que nous avons de Dieu et des Esprits purs, sont composées des idées simples que nous recevons de la Reflexion."
L2_CH_23,je,trouve,trouver,5.85,NAN,"que je connais un petit nombre de choses , et quelques - unes de celles -là , ou , peut-être , toutes , d’ une manière imparfaite","que je connaître un petit nombre de chose , et quelque - un de celui -là , ou , peut-être , tout , d’ un manière imparfait","Si je trouve que je connais un petit nombre de choses, et quelques-unes de celles-là, ou, peut-être, toutes, d’une manière imparfaite, je puis former une idée d’un Etre qui en connait deux fois autant, que je puis doubler encore aussi souvent que je puis ajouter au nombre, et ainsi augmenter mon idée de connaissance en étendant sa comprehension à toutes les choses qui existent ou peuvent exister."
L3_CH_02,nous,supposons,supposer,3.29,NAN,qu’ ils sont les signes,qu’ il être le signe,"Mais que les mots ne signifient autre chose que les idées particulières des hommes, et cela par une institution tout-à-fait arbitraire, c’est ce qui parait évidemment en ce qu’ils n’excitent pas toûjours dans l’Esprit des autres, (lors même qu’ils parlent le même Langage) les mêmes idées dont nous supposons qu’ils sont les signes."
L3_CH_03,Nous,voyons,voir,5,pourtant,"que c’ est tout le contraire , car la plus grande partie des mots qui composent les diverses Langues du Monde , sont des termes généraux   : ce qui n’ est pas arrivé par négligence ou par hazard , mais par raison et par nécessité","que c’ être tout le contraire , car le plus grand partie de mot qui composer le divers langue de monde , être un terme général   : ce qui n’ être pas arriver par négligence ou par hazard , mais par raison et par nécessité","Nous voyons pourtant que c’est tout le contraire, car la plus grande partie des mots qui composent les diverses Langues du Monde, sont des termes généraux : ce qui n’est pas arrivé par négligence ou par hazard, mais par raison et par nécessité."
L3_CH_03,je,nie,nier,nan,encore,que la Nature dans la production des Choses en fait plusieurs semblables,que le nature dans le production de chose en faire plusieurs semblable,"Je ne voudrais pas qu’on s’imaginât ici, que j’oublie, et moins encore que je nie que la Nature dans la production des Choses en fait plusieurs semblables."
L3_CH_03,nous,trouverons,trouver,5.85,NAN,que c’ est -là ce qu’ emporte le mot d’ essence selon l’ usage le plus ordinaire qu’ on en fait,que c’ être -là ce qu’ emporter le mot d’ essence selon l’ usage le plus ordinaire qu’ on en faire,Et nous trouverons que c’est-là ce qu’emporte le mot d’essence selon l’usage le plus ordinaire qu’on en fait.
L3_CH_04,nous,trouverons,trouver,5.85,NAN,"que les noms des Idées simples , des Modes mixtes ( sous lesquels je comprends aussi les Relations ) et des Substances ont chacun quelque chose de particulier , par où ils différent les uns des autres","que le nom de idée simple , de mode mixte ( sou lequel je comprendre aussi le relation ) et de substance avoir chacun quelque chose de particulier , par où il différer le un de autre","cependant après avoir fait une revue plus exacte, nous trouverons que les noms des Idées simples, des Modes mixtes (sous lesquels je comprends aussi les Relations) et des Substances ont chacun quelque chose de particulier, par où ils différent les uns des autres."
L3_CH_05,nous,voyons,voir,5,Conformément,"que les hommes imaginent et considèrent rarement aucune autre idée complexe comme une Espèce particulière de Modes mixtes , que celles qui sont distinguées par certains noms","que le homme imaginer et considérer rarement aucun autre idée complexe comme un espèce particulier de mode mixte , que celui qui être distinguer par certain nom","Conformément à cela, nous voyons que les hommes imaginent et considèrent rarement aucune autre idée complexe comme une Espèce particulière de Modes mixtes, que celles qui sont distinguées par certains noms ;"
L3_CH_05,nous,voyons,voir,5,Ainsi,qu’ on ne regarde pas comme deux Espèces d’ actions distinctes de tuer un homme avec une épée ou avec une hache,qu’ on ne regarder pas comme deux espèce d’ action distinct de tuer un homme avec un épée ou avec un hache,"Ainsi nous voyons qu’on ne regarde pas comme deux Espèces d’actions distinctes de tuer un homme avec une épée ou avec une hache, mais si la pointe de l’épée entre la première dans le Corps, on regarde cela comme une Espèce distincte dans les Lieux où cette action a un nom distinct, comme () en Angleterre."
L3_CH_06,nous,concevons,concevoir,6,NAN,"que la possession nous communique plus de perfection , que nous n’ en aurions sin nous en étions privez","que le possession nous communiquer plus de perfection , que nous n’ en avoir sin nous en être priver","L’idée même la plus parfaite que nous ayons de Dieu, n’est qu’une attribution des mêmes Idées simples qui nous sont venues en reflechissant sur ce que nous trouvons en nous-mêmes, et dont nous concevons que la possession nous communique plus de perfection, que nous n’en aurions sin nous en étions privez ;"
L3_CH_06,nous,jugeons,juger,7.4,NAN,"qu’ il vaut mieux jouir que d’ en être privé , et que nous sommes d’ autant plus heureux que nous les possedons dans un plus haut dégré , nous joignons toutes ces choses ensemble en attachant l’ Infinité à chacune en particulier , et par -là nous avons l’ idée complexe d’ un Etre éternel , omniscient , tout-puissant , infiniment sage , et infiniment heureux .","qu’ il valoir mieux jouir que d’ en être priver , et que nous être d’ autant plus heureux que nous le posseder dans un plus haut dégré , nous joindre tout ce chose ensemble en attacher l’ infinité à chacun en particulier , et par -là nous avoir l’ idée complexe d’ un etre éternel , omniscient , tout-puissant , infiniment sage , et infiniment heureux .","Ainsi après avoir acquis par la reflexion que nous faisons sur nous-mêmes, l’idée d’existence, de connaissance, de puissance et de plaisir, de chacune desquelles nous jugeons qu’il vaut mieux jouir que d’en être privé, et que nous sommes d’autant plus heureux que nous les possedons dans un plus haut dégré, nous joignons toutes ces choses ensemble en attachant l’Infinité à chacune en particulier, et par-là nous avons l’idée complexe d’un Etre éternel, omniscient, tout-puissant, infiniment sage, et infiniment heureux."
L3_CH_06,nous,trouverons,trouver,5.85,NAN,que les différentes Espèces sont liées ensemble,que le différent espèce être lier ensemble,"Et ainsi, jusqu’à ce que nous arrivions aux plus basses et moins organisées parties de matière, nous trouverons par tout, que les différentes Espèces sont liées ensemble ; et ne différent que par des degrés presque insensibles."
L3_CH_06,nous,voyons,voir,5,NAN,qu’ ils vont depuis nous en descendant par des degrés presque insensibles,qu’ il aller depuis nous en descendre par un degré presque insensible,"Et lorsque nous considerons la puissance et la sagesse infinie de l’Auteur de toutes choses, nous avons sujet de penser que c’est une chose conforme à la somptueuse harmonie de l’Univers, et au grand dessein, aussi bien qu’à la bonté infinie de ce souverain Architecte, que les différentes Espèces de Créatures s’élevent aussi peu-à-peu depuis nous vers son infinie perfection, comme nous voyons qu’ils vont depuis nous en descendant par des degrés presque insensibles."
L3_CH_06,nous,trouvons,trouver,5.85,NAN,"que quelques-uns de ces Monstres n’ ont que peu ou point de ces Qualités qu’ on suppose resulter de l’ Essence de cette Espèce d’ où elles tirent leur origine , et à laquelle il semble qu’ elles appartiennent en vertu de leur naissance","que quelques-uns de ce monstre n’ avoir que peu ou point de ce qualité qu’ on supposer resulter de l’ essence de ce espèce d’ où lui tirer son origine , et à lequel il sembler qu’ lui appartenir en vertu de son naissance","car nous trouvons que quelques-uns de ces Monstres n’ont que peu ou point de ces Qualités qu’on suppose resulter de l’Essence de cette Espèce d’où elles tirent leur origine, et à laquelle il semble qu’elles appartiennent en vertu de leur naissance."
L3_CH_06,nous,trouverons,trouver,5.85,NAN,"qu’ il ne fait rien de nouveau , mais que ces genres et ces Espèces ne sont autre chose que des signes plus ou moins étendus , par où nous pouvons exprimer en peu de mots un grand nombre de choses particulières , entant qu’ elles conviennent dans des conceptions plus ou moins générales que nous avons formées dans cette vue .","qu’ il ne faire rien de nouveau , mais que ce genre et ce espèce ne être autre chose que un signe plus ou moins étendu , par où nous pouvoir exprimer en peu de mot un grand nombre de chose particulier , enter qu’ lui convenir dans un conception plus ou moins général que nous avoir former dans ce vue .","Mais si nous considerons exactement ce qui arrive dans la formation de tous ces Genres et de toutes ces Espèces, nous trouverons qu’il ne fait rien de nouveau, mais que ces genres et ces Espèces ne sont autre chose que des signes plus ou moins étendus, par où nous pouvons exprimer en peu de mots un grand nombre de choses particulières, entant qu’elles conviennent dans des conceptions plus ou moins générales que nous avons formées dans cette vue."
L3_CH_08,nous,trouverons,trouver,5.85,NAN,"que nos Idées simples ont toutes des noms abstraits aussi bien que de concrets , dont l’ un ( pour parler en Grammairien ) est un Substantif , et l’ autre un Adjectif , comme blancheur , blanc   ;","que notre idée simple avoir tout un nom abstrait aussi bien que de concret , dont l’ un ( pour parler en grammairien ) être un substantif , et l’ autre un adjectif , comme blancheur , blanc   ;","car si nous y prenons garde, nous trouverons que nos Idées simples ont toutes des noms abstraits aussi bien que de concrets, dont l’un (pour parler en Grammairien) est un Substantif, et l’autre un Adjectif, comme blancheur, blanc ;"
L3_CH_09,nous,trouverons,trouver,5.85,NAN,"que les noms des Modes mixtes sont le plus sujets à être douteux et imparfaits dans leurs significations pour les deux premières raisons , et les noms des Substances pour les deux derniéres","que le nom de mode mixte être le plus sujet à être douteux et imparfait dans leur signification pour le deux premier raison , et le nom de substance pour le deux derniére","car si nous y prenons garde, nous trouverons que les noms des Modes mixtes sont le plus sujets à être douteux et imparfaits dans leurs significations pour les deux premières raisons, et les noms des Substances pour les deux derniéres."
L3_CH_09,nous,trouverons,trouver,5.85,NAN,"que , pour leur faire entendre ce que signifient les noms des Idées simples et des Substances , on leur montre ordinairement la chose dont on veut qu’ ils ayent l’ idée , et qu’ on leur dit plusieurs fois le nom qui en est le signe , blanc , doux , lait , sucre , chien , chat , etc.","que , pour son faire entendre ce que signifier le nom de idée simple et de substance , on son montre ordinairement le chose dont on vouloir qu’ il ayer l’ idée , et qu’ on son dire plusieurs fois le nom qui en être le signe , blanc , doux , lait , sucre , chien , chat , etc.","Car si nous prenons la peine de considérer comment les Enfans apprennent les Langues, nous trouverons, que, pour leur faire entendre ce que signifient les noms des Idées simples et des Substances, on leur montre ordinairement la chose dont on veut qu’ils ayent l’idée, et qu’on leur dit plusieurs fois le nom qui en est le signe, blanc, doux, lait, sucre, chien, chat, etc."
L3_CH_10,nous,voyons,voir,5,NAN,que d’ autres personnes de bon sens qui par leur éducation n’ ont pas été dressez à cette espèce de subtilité,que d’ autre personne de bon sens qui par son éducation n’ avoir pas être dresser à ce espèce de subtilité,"Car nous voyons tous les jours que d’autres personnes de bon sens qui par leur éducation n’ont pas été dressez à cette espèce de subtilité, peuvent exprimer nettement leurs pensées les uns aux autres et se servir utilement du Langage en le prenant dans sa simplicité naturelle."
L3_CH_10,nous,concevons,concevoir,6,non,que différentes solidités,que différents solidité,"Telle étant notre idée de la Matière, nous ne concevons non plus différentes Matières dans le Monde que différentes solidités, nous ne parlons non plus de différentes Matières que de différentes solidités,"
L3_CH_10,nous,supposons,supposer,3.29,NAN,"que le nom d’ homme signifie dans ce cas -là l’ essence réelle d’ une Espèce , et que c’ est autant que si l’ on disait , qu’ un Animal raisonnable renferme une meilleure description de cette Essence réelle , qu’ un Animal à deux piés , sans plume , et avec de larges ongles","que le nom d’ homme signifier dans ce cas -là l’ essence réel d’ un espèce , et que c’ être autant que si l’ on dire , qu’ un animal raisonnable renfermer un meilleur description de ce essence réel , qu’ un animal à deux pié , sans plume , et avec de large ongle","Ainsi, quand nous disons que c’est bien définir l’Homme que de dire qu’il est un Animal raisonnable, et qu’au contraire c’est le mal définir que de dire que c’est un Animal sans plume, à deux piés, avec de larges ongles, il est visible que nous supposons que le nom d’homme signifie dans ce cas-là l’essence réelle d’une Espèce, et que c’est autant que si l’on disait, qu’un Animal raisonnable renferme une meilleure description de cette Essence réelle, qu’un Animal à deux piés, sans plume, et avec de larges ongles."
L3_CH_11,je,remarquerai,remarquer,7,NAN,"que quelqu’ un de des Disputeurs écarte de tous ces termes l’ équivoque et l’ obscurité , ( ce que chacun peut faire à l’ égard des Mots dont il se sert lui-même ) je croirai qu’ il combat véritablement pour la Vérité et pour la Paix , et qu’ il n’ est point esclave de la Vanité , de l’ Ambition , ou de l’ Amour de Parti","que quelqu’ un de un disputeur écarter de tout ce terme l’ équivoque et l’ obscurité , ( ce que chacun pouvoir faire à l’ égard de mot dont il se servir lui-même ) je croire qu’ il combattre véritablement pour le vérité et pour le paix , et qu’ il n’ être point esclave de le vanité , de l’ ambition , ou de l’ amour de parti","Du reste, quand je remarquerai que quelqu’un de des Disputeurs écarte de tous ces termes l’équivoque et l’obscurité, (ce que chacun peut faire à l’égard des Mots dont il se sert lui-même) je croirai qu’il combat véritablement pour la Vérité et pour la Paix, et qu’il n’est point esclave de la Vanité, de l’Ambition, ou de l’Amour de Parti."
L3_CH_11,je,croirai,croire,5.03,NAN,"qu’ il combat véritablement pour la Vérité et pour la Paix , et qu’ il n’ est point esclave de la Vanité , de l’ Ambition , ou de l’ Amour de Parti","qu’ il combattre véritablement pour le vérité et pour le paix , et qu’ il n’ être point esclave de le vanité , de l’ ambition , ou de l’ amour de parti","Du reste, quand je remarquerai que quelqu’un de des Disputeurs écarte de tous ces termes l’équivoque et l’obscurité, (ce que chacun peut faire à l’égard des Mots dont il se sert lui-même) je croirai qu’il combat véritablement pour la Vérité et pour la Paix, et qu’il n’est point esclave de la Vanité, de l’Ambition, ou de l’Amour de Parti."
L3_CH_11,nous,supposons,supposer,3.29,NAN,"que les autres idées qui composent notre idée complexe de cette Espèce , sont attachées","que le autre idée qui composer notre idée complexe de ce espèce , être attacher","Car comme il y a ordinairement en chaque sorte de Substances quelques Qualités directrices, si j’ose m’exprimer ainsi, auxquelles nous supposons que les autres idées qui composent notre idée complexe de cette Espèce, sont attachées, nous donnons hardiment le nom spécifique à la chose dans laquelle se trouve cette marque caracteristique que nous regardons comme l’idée la plus distinctive de cette Espèce."
