Divs,Source,VAP,Lemma,VAP_values,ADV,Target,Target_lemma,Phrase Complete
L4_CH_18,nous,apercevons,apercevoir,nan,NAN,"qu’ il est impossible que deux Idées dont nous voyons intuitivement la disconvenance , doivent être regardées ou admises comme ayant une parfaite convenance entr’elles","qu’ il être impossible que deux idée dont nous voir intuitivement le disconvenance , devoir être regarder ou admettre comme avoir un parfait convenance entr’elle","Parce que l’évidence que nous avons, premièrement, que nous ne nous trompons point en attribuant une telle chose à Dieu, et en second lieu, que nous en comprenons le vrai sens, ne peut jamais être si grande que l’évidence de notre propre Connaissance Intuitive par où nous apercevons qu’il est impossible que deux Idées dont nous voyons intuitivement la disconvenance, doivent être regardées ou admises comme ayant une parfaite convenance entr’elles."
L4_CH_19,Je,suppose,supposer,3.29,NAN,"que c’ est là ce qu’ il faut entendre proprement par Enthousiasme , qui sans être fondé sur la Raison ou sur la Revelation divine , mais procedant de l’ imagination d’ un Esprit échauffé ou plein de lui-même , n’ a pas plûtôt pris racine quelque part , qu’ il a plus d’ influence sur les Opinions et les Actions des hommes que la Raison ou la Revelation , prises séparément ou jointes ensemble","que c’ être là ce qu’ il falloir entendre proprement par Enthousiasme , qui sans être fonder sur le raison ou sur le revelation divin , mais proceder de l’ imagination d’ un esprit échauffer ou plein de lui-même , n’ avoir pas plûtôt prendre racine quelque part , qu’ il avoir plus d’ influence sur le opinion et le action de homme que le raison ou le revelation , prendre séparément ou joindre ensemble","Je suppose que c’est là ce qu’il faut entendre proprement par Enthousiasme, qui sans être fondé sur la Raison ou sur la Revelation divine, mais procedant de l’imagination d’un Esprit échauffé ou plein de lui-même, n’a pas plûtôt pris racine quelque part, qu’il a plus d’influence sur les Opinions et les Actions des hommes que la Raison ou la Revelation, prises séparément ou jointes ensemble"
L4_CH_19,je,connais,connaître,7,NAN,"qu’ il est tel que je le vois , par l’ évidence de la chose même","qu’ il être tel que je le voir , par l’ évidence de le chose même","Ce que je vois, je connais qu’il est tel que je le vois, par l’évidence de la chose même."
L4_CH_19,nous,voyons,voir,5,Ainsi,"que les Saints hommes qui recevaient des revelations de Dieu , avaient quelque autre preuve que la lumière intérieure qui éclatait dans leurs Esprits , pour les assurer que ces Revelations venaient de la part de Dieu","que le saint homme qui recevoir un revelation de Dieu , avoir quelque autre preuve que le lumière intérieur qui éclater dans leur esprit , pour le assurer que ce revelation venir de le part de Dieu","Ainsi nous voyons que les Saints hommes qui recevaient des revelations de Dieu, avaient quelque autre preuve que la lumière intérieure qui éclatait dans leurs Esprits, pour les assurer que ces Revelations venaient de la part de Dieu."
L4_CH_20,je,pense,penser,5.46,NAN,"qu’ en ce cas -là nous n’ avons pas le choix de nous déterminer pour le côté que nous voulons , s’ il y a entr’eux des différences tout-à-fait visibles","qu’ en ce cas -là nous n’ avoir pas le choix de nous déterminer pour le côté que nous vouloir , s’ il y avoir entr’eux un différence tout-à-fait visible","Mais lorsque l’Esprit juge que la Proposition renferme quelque chose à quoi il prend intérêt, lorsqu’il croit que les conséquences qui suivent de ce qu’on la reçoit ou qu’on la rejette, sont importantes, et que le Bonheur ou le Malheur dépendent de prendre ou de refuser le bon parti, de sorte qu’il s’applique serieusement à en rechercher et examiner la Probabilité, je pense qu’en ce cas-là nous n’avons pas le choix de nous déterminer pour le côté que nous voulons, s’il y a entr’eux des différences tout-à-fait visibles."
L4_CH_20,nous,trouverions,trouver,5.85,toûjours,que ce soit le pur amour de la Vérité qui leur a fait recevoir les Doctrines qu’ ils professent et soutiennent publiquement,que ce être le pur amour de le vérité qui son avoir faire recevoir le doctrine qu’ il professer et soutenir publiquement,"Si nous pouvions voir les secrets motifs qui font agir les personnes de nom, les Savants, les Chefs de Parti, nous ne trouverions pas toûjours que ce soit le pur amour de la Vérité qui leur a fait recevoir les Doctrines qu’ils professent et soutiennent publiquement."
